Objeto,Categoria
"CONTRATAÇÃO DE PESSOAS JURÍDICAS ESPECIALIZADAS NAS EXECUÇÃOÕES DOS SERVIÇOS DE IMPERMEABILIZAÇÃO COM INJEÇÃO DE POLIURETANO NA ARQUIBANCADA DO CAMPO DE FUTEBOL DO CENTRO POLIESPORTIVO DR. EDGAR PINHEIRO DIAS, COM FORNECIMENTO DE TODOS OS MATE...",10205
"CONTRATAÇÃO DE EMPRESA PARA EXECUÇÃO DE REFORMA PARA AMPLIAÇÃO, ADEQUAÇÃO E MELHORIAS PARA A IMPLANTAÇÃO DA UBS ALTO DA SERRA, SITUADO À RUA TERESA, Nº 1.781 - PETRÓPOLIS/RJ - EMENDA PARLAMENTAR Nº 11129.4920001/24-002 - PORTARIA GM/MS Nº ...",10101
CONTRATAÇÃO DE EMPRESA PARA FORNECIMENTO E INSTALAÇÃO DE TRANSFORMADOR TRIFÁSICO EM BARRACÃO DE PROPRIEDADE DO MUNICÍPIO DE TRÊS BARRAS DO PARANÁq * https://bllcompras.com *,10208
"Registro de preço com lotes exclusivos para Microempresa e/ou empresa de pequeno porte, nos moldes da LC 123/09, LC 147/14 e Lei Municipal 690/21, e lotes de ampla concorrência para eventual prestação de serviços gerais de topografia e engenharia co...",40101
"- Contratação de serviços de Engenharia para execução das obras de calçamento no Bairro Ana Rita, Timóteo MG, conforme especificações, quantitativos e condições estabelecidas nos anexos do edital. * www.compras.gov.br *",10205
"- Contratação de empresa especializada na prestação de serviço comum de engenharia para a construção da feira localizada no complexo Brasil Novo, no município de Rio Largo/AL. * www.compras.gov.br *",10101
"REGISTRO DE PREÇOS PARA UMA EVENTUAL PRESTAÇÃO DE SERVIÇOS DE MANUTENÇÃO CIVIL DE PRÉDIOS PÚBLICOS DA EDUCAÇÃO, ASSISTENCIA SOCIAL, ADMINISTRAÇÃO, PEQUENAS REFORMAS E MANUTENÇÕES DE PONTES PENSEIS DO MUNICÍPIO DE PRAIA GRANDE/SC. * https:/...",10110
"Contratação de empresa especializada no desenvolvimento de projetos básicos, complementares e a fiscalização da implantação de uma usina fotovoltaica com potência instalada de 100 Kwp e inversores de 75 Kw no Município de São João do Triunfo. ...",30101
- Contratação de empresa de engenharia ou arquitetura e urbanismo para execução de obras de pavimentação e drenagem pluvial a serem executadas na Avenida Pinheiro do Distrito Industrial situado na área urbana de Timóteo. * www.compras.gov.br *,10205
REGISTRO DE PREÇOS PARA CONTRATAÇAO DE EMPRESA PARA PRESTAÇAO DE SERVIÇOS ELETRICOS DE CARATER PREVENTIVO E CORRETIVO NAS INSTALAÇOES DE PREDIOS PUBLICOS DA PREFEITURA DE JAPURA  PR E SEUS RESPECTIVOS DEPARTAMENTOS * https://bnccompras.com *,10110
"- Contratação de empresa especializada em engenharia para execução de obras de revitalização de área pública com elaboração de projeto na Praça Cecília Apolinário Trapiá, localizada na Rua Oscar Nelson com Av. Piero Di Lorenzo- JD Santa Edw...",10205
Modalidade tomada de preço para ampliação e/ ou reforma do prédio escolar.,10101
"Contratação de empresa especializada na área de engenharia e/ou arquitetura para prestação do serviço reparo e adaptações no telhado e banheiros da Academia de Bombeiros Militar ABM, conforme especificações, exigências e quantidades estabeleci...",10110
"FORNECIMENTO DE MATERIAS E MÃO DE OBRA, PARA EXECUÇÃO DAS OBRAS DE CONSTRUÇÃO DE PARQUE PÚBLICO MUNICIPAL ABERTO JUNTO AO CENTRO DE EVENTOS, de acordo com a Lei nº 14.133/21 e alterações posteriores, pelas normas, especificações e condições ...",10205
"Concessão administrativa para a ampliação, melhoramento, reforma, manutenção e gestão do Instituto Municipal de Ensino Superior de São Manuel - IMES/SM, visando a ampliação das atividades acadêmicas da instituição e oferta de novos cursos nas...",10101
CONTRATAÇÃO DE PESSOA JURÍDICA ESPECIALIZADA NA PRESTAÇÃO DE SERVIÇOS DE CONSULTORIA E ASSESSORIA NA ÁREA DE ENGENHARIA CIVIL * https://licitanet.com.br *,30101
"Contratação de empresa de engenharia para execução de obras/serviços de REFORMA DA PRAÇA HÉLIO NEVES DA ROCHA, NO MUNICÍPIO DE AMARGOSA - BA, através do FINISA, descritos no instrumento de projeto básico, pelo tipo de licitação menor preço, ...",10205
REGISTRO DE PREÇOS PARA FUTURA E EVENTUAL CONTRATAÇÃO DE PF OU PJ PARA PRESTAÇÃO DE SERVIÇOS NAS ÁREAS DE ENGENHARIA CIVIL E AMBIENTAL,30201
"REGISTRO DE PREÇOS PARA FUTURA E EVENTUAL CONTRATAÇÃO DE SERVIÇOS DE SONDAGEM A PERCUSSÃO, COM EMISSÃO DE RELATÓRIO COMPLETO DE INVESTIGAÇÃO DO SOLO PARA DIMENSIONAMENTO DE FUNDAÇÕES PARA OBRAS A SEREM EXECUTADAS NO MUNICÍPIO DE JABORÁ, COM...",40101
"Contratação de pessoa jurídica para prestação de serviços de instalação elétrica e hidráulica, conforme especificações contidas no edital.",10110
"Contratação de empresa especializada, cujo critério de seleção da proposta mais vantajosa será a de menor preço global, para CONSTRUÇÃO DA COBERTA DA QUADRA ESCOLAR NO MUNICÍPIO DE SERRA GRANDE-PB, conforme condições, quantidades e exigência...",10101
CONTRATAÇÃO DE EMPRESA ESPECIALIZADA PARA EXECUÇÃO DA OBRA DE AMPLIAÇÃO DO ALMOXARIFADO DO PRÉDIO ONDE FUNCIONA A FAMÁCIA BÁSICA DO MUNICÍPIO DE ALTO CAPARAÓ/MG,10101
Conclusão do Centro Cultural de Monte Alegre dos Campos/RS,10101
"CONTRATAÇÃO DE EMPRESA ESPECIALIZADA PARA CONSTRUÇÃO DE UNIDADE DE SÁUDE TIPO CAPS CENTRO DE ATENÇÃO PSICOSSOCIAL, CONFORME PLANTA BAIXA APROVADA JUNTO A SUVISA, LOCALIZADA NO BAIRRO LINDO HORIZONTE, ABADIÂNIA-GO, CONFORME DESCRITO NO TERMO DE RE...",10101
"Registro de preços para eventual e futura contratação de empresa para serviços gerais de limpeza, conservação, manutenção em vias públicas e áreas públicas, como roçadas, cortes de grama, capinas, aplicação de defensivos e limpeza de áreas...",20203
- Revitalização de Acessos da Comunidade do Preventório Charitas - Niteroi/RJ. * www.compras.gov.br *,10205
"prestação de serviços de pavimentação intertravada e drenagem de águas pluviais em vias públicas - Rua André Luiz Gusmão de Almeida e Rua Orivaldo Pasqualini, Bairro Chico Rosa",10205
- Contratação de empresa para execução de obra de reforma para melhoria do Almoxarifado Municipal. * www.compras.gov.br *,10101
- Contratação de serviço de engenharia destinado à revisão da rede externa de esgoto que atende o Serviço de Gestão de Rejeitos Radioativos - SEGRR do IPEN/CNEN * www.compras.gov.br *,10209
"- Contratação de serviços de engenharia para demolição do antigo prédio do SASE, situado à Avenida Julio Antônio Thurler, Olaria, Nova Friburgo, a fim de viabilizar a futura construção da UPA Porte III de Olaria. * www.compras.gov.br *",10101
CONTRATAÇÃO DE SERVIÇOS DE EMPRESA PARA EXECUÇÃO DE ILUMINAÇÃO DE LED NOS ESTÁDIOS,10208
"- Execução da obra de construção/recuperação/complementação de estradas vicinais padrão alimentadora, na ilha Trambioca, no município de Barcarena, Estado do Pará. * www.compras.gov.br *",10201
"- VIII - OBJETO Contratação de empresa especializada no ramo de engenharia para execução de obras de CONSTRUÇÃO DE ESCADARIA, CONTENÇÃO, DRENAGEM E PAVIMENTAÇÃO EM PARALELEPÍPEDO NA RUA 19 DE ABRIL NO BAIRRO EUCLIDES NETO, no Município de Ipi...",10205
"Contratação de empresa para execução da obra de COBERTURA DO TIPO SOMBREADORES em prédios públicos com estacionamento na zona urbana de Goianorte - TO, junto a Prefeitura Municipal. * https://bnccompras.com *",10101
Reversão de Rede Elétrica Aérea para Subterrânea,10208
"CONTRATAÇÃO DE EMPRESA PARA PRESTAÇÃO DE SERVIÇO DE MÃO DE OBRA COM FORNECIMENTO DE EQUIPAMENTOS E MATERIAIS PARA EXECUÇÃO DA NOVA UNIDADE DE ENSINO DO BAIRRO RIO PEQUENO NO MUNICÍPIO DE CAMBORIÚ, CONFORME PROJETO BÁSICO E SEUS ELEMENTOS CONS...",10101
"Prestação dos serviços de execução conservação preventiva de pavimentos asfálticos, a serem prestados nos municípios que compõe o LOTE 68 do programa Goiás em movimento - eixo municípios Aporé, Lagoa Santa, São Simão e Jataí, no estado d...",10205
"EFICIENTIZAÇÃO, OPERAÇÃO E MANUTENÇÃO DA ILUMINAÇÃO PÚBLICA, IMPLANTAÇÃO, OPERAÇÃO E MANUTENÇÃO DA INFRAESTRUTURA DE TELECOMUNICAÇÕES E USINA FOTOVOLTAICA para o município de Vargem Alta.",10208
"Contratação de Empresa de Engenharia para Execução de Obra Civil para Reforma e Adequação Predial para Implantação da Nova Ursi Capela do Socorro, Incluindo o Fornecimento de Insumos Materiais, Mão de Obra e Equipamentos - Critério Menor Preço...",10101
"Contratação de empresa para execução de obras de Pavimentação em CBUQ, na Rua São Pedro - Bairro Parque São Jorge conforme trechos definidos em projeto, incluindo: serviços preliminares, terraplenagem, base e sub-base, revestimento, meio fio e s...",10205
"Contratação de empresa esp. p/ o fornecimento de material, mão de obra e direção técnica para execução de obra de contenção de talude com muro de gabião, conforme documentação",10206
Contratação de empresa especializada para serviços de mão de obra com fornecimento de materiais e equipamentos para obras de reforma do prédio da Polícia Militar no município de Descalvado-SP. * https://bnccompras.com *,10101
"Contratação de empresa de Arquitetura/Engenharia para o Serviço de assessoramento à Administração, através da realização de atividades de supervisão e fiscalização das obras de reforma e ampliação da Unidade do Colégio Tiradentes da Políc...",30101
"CONTRATAÇÃO DE EMPRESA QUALIFICADA PARA ELABORAÇÃO DE PROJETO EXECUTIVO DE ENGENHARIA, PARA CONSTRUÇÃO DE 01 UMA PONTE DE CONCRETO ARMADO SOBRE O RIO SÃO JOÃO, NA RODOVIA MS-320, COORDENADAS 19°15'24.90""S 52°54'31.10""W, TENDO COMPRIMENTO ESTIMA...",30101
"A presente licitação tem por objeto o REGISTRO DE PREÇOS para possível aquisição e instalação de laje de transposição de ponte para atender a demanda da Secretaria de Serviços Municipais, conforme relação de itens constantes no Anexo I deste...",10204
"CONTRATAÇÃO DE PESSOAS JURÍDICAS ESPECIALIZADAS EXECUÇÃO DOS SERVIÇOS DE ENGENHARIA, CONCERNENTE NA IMPLANTAÇÃO DE ILUMINAÇÃO DO CAMPO DE FUTEBOL E DE UMA SUBESTAÇÃO, NO CENTRO POLIESPORTIVO DR. EDGAR PINHEIRO DIAS, COM O FORNECIMENTO DE TODO...",10208
"CONTRATAÇÃO DE EMPRESA PARA EXECUÇÃO DE ADEQUAÇÃO DE ESTRADAS VICINAIS, DE ACORDO COM O CONVENIO Nº 950347/2023, ENTRE MINISTÉRIO DA INTEGRAÇÃO E DO DESENVOLVIMENTO REGIONAL E O MUNICÍPIO DE BURITI DOS LOPES - PI",10201
"Contratação de empresa especializada para a execução do cercamento da Área de Preservação Permanente APP 2, no Loteamento de Interesse Social Renascer, localizado no Bairro SESI, com fornecimento de materiais e mão de obra.",10307
contratação de empresa para a execução de implantação de melhorias no campo de futebol local: Povoado Quadros no município de Zé Doca * https://licitanet.com.br *,10205
"CONTRATAÇÃO DE SERVIÇOS DE ENGENHARIA PARA EXECUÇÃO DE OBRA: CONSTRUÇÃO E URBANIZAÇÃO DA PRAÇA NOVA E PRAÇA VILA SÃO JOÃO, REFERENTE A PROPOSTA/CONVÊNIO: 947859/2023-CAIXA",10205
CONTRATAÇÃO DE EMPRESA ESPECIALIZADA QUE FORNEÇA MATERIAIS E MÃO DE OBRA PARA CONSTRUÇÃO DE 05CINCO ALAS NAS CABECEIRAS DAS PONTES SOB O ARROIO JACUTINGA NO PERIMETRO URBANO DO MUNICIPIO,10204
1654505 - Processo de Contratação - Execução dos Vestiários e Infraestrutura para Ar Comprimido - SAS ERMELINO * www.publinexo.com.br/privado/ *,10101
CONTRATAÇAO DE EMPRESA ESPECIALIZADA EM SERVIÇOS DE ENGENHARIA PARA A EXECUÇAO DE OBRA DENOMINADA CONTRUÇAO DE MURO DE ARRIMO COM DRENAGEM ALAMBRADO  E CALÇAMENTO NA CRECHE AROEIRA * https://bnccompras.com *,10206
"Contratação da obra de construção do Centro Aquático, neste município. * https://bnccompras.com *",10205
- Contratação de empresa especializada na execução de obra de engenharia para ampliação de salas da Câmara Municipal da cidade de Mogi Guaçu-SP * www.compras.gov.br *,10101
- Revitalização de acessos na Rua Luiz Muriat - Bairro de Fátima. * www.compras.gov.br *,10205
"CONTRATAÇÃO DE EMPRESA ESPECIALIZADA PARA OBRA DE CONCLUSÃO DE CONSTRUÇÃO DE ESCOLA DE 06 SALAS, PADRÃO FNDE, LOCALIZADA NO BAIRRO CAVALETE, NESTE MUNICÍPIO. VALOR: R$ 2.561.595,44 DOIS MILHÕES, QUINHENTOS E SESSENTA E UM MIL, QUINHENTOS E NOVEN...",10101
IMPLANTAÇÃO DA ADUTORA DE ÁGUA TRATADA - RAD ESCALAVRADO À ETA 3 NA LOCALIDADE DE LAGOA FUNDA - SIAA BRUMADO. * http://www.licitacoes-e.com.br *,10209
- Reforma do Prédio da Pós-graduação da Faculdade de Engenharia de Bauru * www.compras.gov.br *,10101
"- Contratação de empresa de engenharia para instalação de Usina de Paineis Solares, convênio ITAIPU 4007855-00 * www.compras.gov.br *",10208
"- Contratação de empresa especializada para realização de ampliação de 83,6 M2 na escola de ensino Infantil Criança Sorrindo conforme projeto, planilhas orçamentárias, relatório técnico, cronograma físico financeiro e demais anexos constantes...",10101
"- Contratação de pessoa jurídica para construção de adutora de água e reservatório no distrito de são roque, vila celeste e rede de abastecimento de água no jardim das flores em são clemente, de acordo com os projetos, memoriais descritivos, cr...",10209
"- Contratação de empresa de engenharia ou arquitetura e urbanismo para execução de obras de construção da Praça Limoeiro, no bairro Limoeiro no Município de Timóteo, conforme condições e exigências no Edital e anexos. * www.compras.gov.br *",10205
"- Contratação de serviços de Engenharia para execução das obras de serviços de engenharia para revitalização da Praça Vila Lobos, situada no Alphaville, Timóteo/MG, conforme especificações, quantitativos e condições estabelecidas nos anexos...",10205
"* Registro de preços * * Licitação Eletrônica * SERVIÇO DE INSTALAÇÃO E MANUTENÇÃO DE REDES PLUVIAIS COMPOSTAS POR TUBOS DE CONCRETO, BOCAS DE LOBO E CAIXAS DE PASSAGEM",10205
"- Ref. contratação de empresa para realização de serviços de OBRAS DE REFORMA DA PRAÇA DO BAIRRO RETIRO POÉTICO, Rua Nacib Simão, esquina com a Rua Moacir Pinto Coelho, bairro Retiro Poético, Cordeiro/RJ, conforme condições, quantidades e exig...",10205
"- CONCLUSÃO DO CENTRO DE EDUCAÇÃO INFANTIL - CEI, NO MUNICÍPIO DE FORQUILHA - CE, nas condições estabelecidas no edital e seus anexos. * www.compras.gov.br *",10101
"- Contratação de empresa especializada para prestação de serviços de coleta, transporte, tratamento e destinação final de Resíduos dos Serviços de Saúde RSS, em atendimento a Secretaria Municipal de Saúde. * www.compras.gov.br *",20201
"- Contratação de empresa para execução da obra de Reforma Geral e Ampliação da Escola Municipal Professora Leci Caldeira Scherner, localizada na Rua Miescelau Grabias, nº 662, Bairro Guatupê. * www.compras.gov.br *",10101
"Contratação de pessoa jurídica para realizar a requalificação do prédio do Instituto de Previdência dos Servidores Municipais de Itapipoca - CE, ITAPREV.",10101
"Contratação de empresa para prestação de serviços de até 27 Furos de sondagem geotécnica à percussão, no solo, conforme demanda em áreas indicadas pela Prefeitura Municipal de Ponto Belo-ES.",40101
"Revitalização do Banheiro do Bairro do Ecatu, Velórios do Bairro do Ecatu e Ibiporanga e CETAM, no municipio de Tanabi, Estado de São Paulo, conforme Planilhas e Termos de Referencia.z",10101
"Contratação de empresa para revitalização da praça do campo de Itamira, na rua das Flores.",10205
"Construção de Praça Infantil para colocação Futura de Brinquedos, localizado no município de Cristal do Sul - RS",10205
"contratação de empresa especializada em Serviços de Engenharia para execução da obra de Reforma da Praça da Igreja Matriz ""Nossa Senhora de Lourdes"", sediada na Zona Urbana deste Município, em atendimento à Secretaria Municipal de Planejamento e ...",10205
CONSTRUÇÃO DE UMA UNIDADE BÁSICA DE SAÚDE PARA UMA EQUIPE DE SAÚDE DA FAMÍLIA E UMA EQUIPE DE SAÚDE BUCAL NO DISTRITO DE SÃO JOÃO DA PRATA * https://bllcompras.com *,10101
- Contratação de Serviços de empresa especializada para ADEQUAÇÃO DE SALAS DOS PROFESSORES DA DIVISÃO DE ENSINO da Academia da Força Aérea. * www.compras.gov.br *,10101
"- Revitalização de Acessos na Comunidade Serrao Travessa Natal, no Município de Niterói/RJ. * www.compras.gov.br *",10205
CONTRATAÇÃO DE EMPRESA DE ENGENHARIA E/OU ARQUITETURA PARA REFORMA E AMPLIAÇÃO DA ESCOLA MUNICIPAL ALUÍSIO SEBASTIÃO MORENO DISTRITO PIRANGI * https://bnccompras.com *,10101
- Revitalização de Acesso na Rua Padre José Euges - Beco da Penha Ititioca- Niteroi/RJ. * www.compras.gov.br *,10205
- Prestação de Serviços de Substituição de Rede de Esgoto e Reforma de Sanitários da Intercorrência Clínica * www.compras.gov.br *,10110
CONTRATAÇÃO DE EMPRESA DE ENGENHARIA ESPECIALIZADA PARA REFORMA DA UBS VERÔNICA FAVALESSA PESTANA  BAIRRO SANTO ANTONIO.,10101
"Contratação serviços topográficos, como levantamento cadastral, planialtimetrico, planimétrico, altimétrico mapas e memoriais descritivos.",40101
- Revitalização dos acessos na Rua 22 de Novembro e Travessa Orleans - Fonseca Niteroi/RJ. * www.compras.gov.br *,10205
- Contratação de serviço de manutenção e reforma da FME malote * www.compras.gov.br *,10101
ADEQUAÇÃO DE ESTRADAS VICINAIS NO MUNICIPIO DE ÁGUA FRIA-BA.,10201
- Revitalização de Acessos na Terceira Escada - Ititioca - Niteroi/RJ. * www.compras.gov.br *,10205
"- Contratação de empresa especializada do ramo da construção civil para a reforma nas unidades básicas de saúde: Amelânia Rocha - Bairro de Santo Antônio, Alzira Alves da Costa - Bairro de Paulo VI, zabel Francisca Teixeira - Sítio Mocambo, Mari...",10101
MANUTENÇÃO E CONSERVAÇÃO DE BENS IMÓVEIS,10110
"CONTRATAÇÃO DE EMPRESA ESPECIALIZADA EM PAVIMENTAÇÃO ASFÁLTICA, DRENAGEM, CALÇADA, GUIA E SARJETA DAS RUAS FERNANDO GIUST, RUA GERALDO FRANCISCHETT, RUA LURDES DA SILVA LISBOA, RUA 10, RUA BENEDITO PRADO, RUA PROFª. MARIA DE BARROS LEITE PARANHOS...",10205
"- Revitalização de Acessos na 22 de Novembro - Rua Pereira Faustino, no bairro Fonseca. * www.compras.gov.br *",10205
- Revitalização de Acessos na Travessa São José Cubango - Niterói/RJ. * www.compras.gov.br *,10205
CONSTRUÇÃO DO POSTO DE VACINAÇÃO NO DISTRITO DE IBITIRA.,10101
"Empreitada por preço unitário, para a construção de Quadra de Esportes no Campus de Cascavel, da Universidade Estadual do Oeste do Paraná - UNIOESTE - licitação exclusiva para microempresas e/ou empresas de pequeno porte.             ",10205
"CHAMAMENTO PÚBLICO Nº003/2024-SMAZU   REALIZAR AÇÕES EDUCATIVAS E MOBILIZAR A POPULAÇÃO DA ÁREA DA BACIA DO JAGUARI E DA BACIA DO MERENDA/IPIRANGA, QUE DESÁGUAM NO RIO PARAÍBA DO SUL, COM O OBJETIVO DE PROTEGER AS NASCENTES NELAS INSERIDAS E CON...",30201
- Revitalização de Acessos na Rua Rufino Adans Saens e Vicente Celestino Ponte Velha Viçoso Jardim. * www.compras.gov.br *,10205
"CONTRATAÇÃO DE EMPRESA ESPECIALIZADA PARA EXECUÇÃO DE CONSTRUÇÃO DE UM BARRACÃO COM SALAS PARA FARMÁCIA, DESPENSA, BANHEIRO E ÁREA ABERTA, NA LINHA JACUTINGA - MISSAL/PR, COM ÁREA DE OBRA DE 60 M². * https://bllcompras.com *",10101
"- Revitalização de Acessos da Rua Inácio Bezerra de Menezes, Martins Torres. * www.compras.gov.br *",10205
"- Revitalização de acessos da Travessa Manoel Rodrigues de Almeida - Cubango, no Município de Niterói/RJ. * www.compras.gov.br *",10205
"Prestação de serviços de engenharia paraa2ª etapa da reforma e adequação no imóvel que abrigaráaDelegacia de Polícia Civil de Montalvânia, localizada na Avenida Confúcio, nº 558, Bairro Centro, Montalvânia/MG.",10101
Contratação de empresa especializada para prestação de serviço de regularização fundiária REURB de núcleos urbanos informais de interesse social do município de São José dos Campos.  ,30101
"Contratação de empresa especializada para serviço de licenciamento ambiental, contemplando a regularização de 04 áreas de lavra de saibro/cascalho, realizando todos os projetos para obtenção da Licença de Operação e Regularização, bem como o...",30201
"Contratação de empresa para Construção de Cobertura da Quadra Poliesportiva da EEB Vereador Jurandir Pereira dos Santos, localizada no bairro Cigana. * https://bllcompras.com *",10101
"Contratação Integrada de empresa especializada em engenharia e/ou arquitetura, para elaboração de projetos básico ND 350, legal e executivo ND400 de arquitetura, projetos complementares de engenharia, aprovação nos órgãos competentes, As Built N...",10101
CONTRATAÇÃO DE EMPRESA PARA PRESTAÇÃO DE SERVIÇOS DE SONDAGEM COM PERCOLAÇÃO DO SOLO E EMISSÃO DE ART ATESTADO DE RESPONSABILIDADE TÉCNICA PARA ANÁLISE DO SOLO PARA REALIZAÇÃO DE PROJETOS E OBRAS * https://bllcompras.com *,40101
"Refere-se a Registro de Preços para Futura, Eventual e Parcelada Contratação de Empresa Especializada para Prestação de Serviços de Implementação de Medidas de Topografia e de Agrimensura, a fim de Promover a Regularização Fundiária nas Modali...",40101
"- O objeto da licitação é a prestação do serviço de Demolição de Imóvel e Readequação da Via Padre Francisco Pinto, nas condições estabelecidas neste edital e seus anexos. * www.compras.gov.br *",10101
Aquisição e instalação do KIT DE MEDIDAS MÍNIMAS DE COMBATE A INCÊNDIO E PÂNICO no 04,10110
"Contratação de Empresa de Engenharia especializada em serviços técnicos na área de Engenharia Civil e experiência em convênios com a disponibilidade de profissionais engenheiro civil, para atender as demandas da Secretaria Municipal de Planejament...",30101
"FUTURA CONTRATAÇÃO DE EMPRESA ESPECIALIZADA PARA OS SERVIÇOS DE DESENTUPIMENTO, LIMPEZA E ESGOTAMENTO DE FOSSA E CAIXA DE GORDURA DOS PRÉDIOS PÚBLICOS MUNICIPAIS DE BALNEÁRIO PIÇARRAS/SC.",20102
- Contratação de empresa para Pintura do CMEI Maria Anadão Molina e CMEI Arte de Crescer * www.compras.gov.br *,10110
"CONTRATAÇÃO DE EMPRESA ESPECIALIZADA PARA AMPLIAÇÃO DA UNIDADE BÁSICA DE SAÚDE EMÍLIO GAVIOLI, na Cidade de Rio Crespo-RO. * https://licitanet.com.br *",10101
"Recuperação de estradas vicinais e construção de pontes em madeira - Trecho 1: Zé Castor/Tv. do Dez - 21,2 km, com coordenadas Iniciais 01° 07'10- S 46° 30'26- W e Finais 01° 13'10- S 46° 35'35- W, Trecho 2: Aturiaí/Apió 9,6 km com coordenadas...",10201
"Ampliação da Policlínica Municipal de Mutum/MG, objeto do contrato de repasse OGU nº 921820/2021 - operação 1081203-48 - Programa Atenção Especializada à Saúde - ampliação de unidades de atenção especializada em saúde * https://licitar.dig...",10101
"CONTRATAÇÃO DE EMPRESA ESPECIALIZADA PARA PRESTAÇÃO DE SERVIÇO DE EXECUÇÃO DE PROJETO DE PPCI, INCLUSOS FORNECIMENTO DE MATERIAIS E INSTALAÇÃO, NA SECRETARIA MUNICIPAL DE SERVIÇOS PÚBLICOS.",10110
"contratação de empresa especializada na execução de obra de construção de UBS Tipo II, p/funcionamento do PSF IV, que sera situado no Complexo Viário José Ermírio de Moraes Filho, s/n, Bairro: Centro, neste município, c/o fornecimento de todos ...",10101
"- Ref. escolha da proposta mais vantajosa para a contratação de empresa de engenharia especializada em cartografia, aerofotogrametria e geoprocessamento para a produção do mapeamento urbano básico mub, conforme condições, quantidades e exigências...",40201
"MENOR VALOR POR LOTE, objeto: AQUISIÇÃO E MONTAGEM DE SALAS DE AULA, SALAS ADMINISTRATIVAS, LABORATÓRIOS E SANITÁRIOS MODULARES.",10101
"CONTRATAÇÃO DE EMPRESA DE ENGENHARIA PARA EXECUTAR CONSTRUÇÃO DE 06 UNIDADES DE PASSAGEM MOLHADAS, CONFORME PROJETOS BÁSICOS, PLANILHAS ORÇAMENTÁRIAS E DEMAIS DOCUMENTOS QUE COMPÕEM O ANEXO I DO EDIT",10201
CONTRATAÇÃO DE EMPRESA ESPECIALIZADA PARA EXECUÇÃO DE MELHORIAS NA ILUMINAÇÃO DO CAMPO DE FUTEBOL MUNICIPAL LOCALIZADO NA PRAÇA DE ESPORTE CAPITÃO JOSÉ ANSELMO,10208
"contratação de empresa para execução de obras e serviços de engenharia, com fornecimento de materiais e mão de obra especializada, visando a realização de serviços de recapeamento asfáltico de vias urbanos, meio-fio com sarjeta, calçadas, dre...",10205
"Contratação de empresa para a realização da etapa I do Complexo Automobilístico Espumoso Park Racing, com a prestação de serviço de drenagem e pavimentação no KM 112 da ERS - 332 do município.",10205
Contratação de empresa para Pintura do CMEI Maria Anadão Molina e CMEI Arte de Crescer,10110
"Contratação  de  empresa  especializada,  no  ramo  de  engenharia,  para  a  prestação  de  serviços  de comuns de   engenharia   para   a   execução   de serviços   de   Manutenção   Predial   Preventiva   e   Corretiva, contemplando os servi...",10110
"Fornecimento de material e mão de obra, referente à execução de drenagem pluvial, pavimentação asfáltica e sinalização de trechos das Ruas ""F' e ""G"" da Vila Lídia, Bairro Noal, município de Santa Maria-RS.",10205
"Contratação de empresa para a construção de Unidade Básica de Saúde no Bairro Maravalha, visando atendimento da demanda do Município.",10101
CONTRATAÇÃO DE EMPRESA PARA CONSTRUÇÃO DE UM PONTILHÃO EM CONCRETO ARMADO E ADUELAS PRÉ FABRICADAS.,10204
Contratação de empresa para substituição de iluminação convencional por iluminação LED em diversos bairros do município * https://sistema.novobbmnet.com.br *,10208
"REGISTRO DE PREÇOS PARA CONTRATAÇÃO DE EMPRESA ESPECIALIZADA PARA EXECUÇÃO DE SERVIÇOS DE PAVIMENTAÇÃO ASFÁLTICA E OBRAS COMPLEMENTARES EM DIVERSAS RUAS DO MUNICÍPIO, COM FORNECIMENTO DE MATERIAIS, CONFORME CONDIÇÕES ESTABELECIDAS NO INSTRUME...",10205
