Objeto,Categoria
"- Adequação da edificação às normas de segurança contra incêndio e execução de Sistemas de Prevenção e Combate a Incêndio no Fórum da Comarca de Bauru, serviços auxiliares e materiais necessários ao seu perfeito funcionamento, bem como a o...",10110
CONTRATAÇÃO DE EMPRESA ESPECIALIZADA PARA REFORMA DA EMEF MARIA DO ROSÁRIO ARCURI DE OLIVEIRA CAMPOS * https://sistema.novobbmnet.com.br *,10101
Contratação de empresa especializada para reforma do CRAS Promorar * https://sistema.novobbmnet.com.br *,10101
"CONTRATAÇÃO DE EMPRESA ESPECIALIZADA PARA SERVIÇOS DE REFORMA E ADEQUAÇÕES DOS PRÉDIOS DE DIVERSAS UNIDADES ESCOLARES DA REDE MUNICIPAL DE ENSINO, COM O FORNECIMENTO DE MATERIAIS E MÃO DE OBRA ESPECIALIZADA, PARA ATENDER REQUISITOS DE SEGURANÇA C...",10101
"- Contratação de empresa especializada em engenharia para execução de obras de revitalização da Rua Boraquira, S/N - Jardim Marilda - São Paulo - SP / Rua Tartaranhão, S/N - Jardim Marilda - São Paulo - SP, 04857-400 / Rua Pomba Do Cabo, Alt. N...",10205
"- Contratação de Empresa Especializada para execução da obra de modernização da subestação de 13,8kv e dos alimentadores dos blocos da Academia e CFAP do Centro de Educação da PMPB. * www.compras.gov.br *",10110
"Contratação de pessoa jurídica especializada para Instalações de sistema de combate a incêndio, para a execução da manutenção do sistema de detecção e alarme de incêndio - SDAI da Escola Técnica Senai em Goiana/PE, para atender às necessid...",10110
"- Registro de Preços para eventual contratação de empresa especializada visando à execução futura de serviços de manutenção da rede de distribuição elétrica da Guarnição de Aeronáutica de Belém, com fornecimento de material, conforme cond...",10208
- Contratação de serviços continuados de Manutenção Predial com regime de dedicação exclusiva de mão de obra * www.compras.gov.br *,10110
REGISTRO DE PREÇOS PARA CONTRATAÇÃO DE EMPRESA PARA PRESTAÇÃO DE SERVIÇOS DE MANUTENÇÃO E RECUPERAÇÃO DE PRÉDIOS Públicos E PAVIMENTOS NO MUNICÍPIO DE PALMEIRAIS-PI.,10110
"Contratação de serviços para execução da obra de reforma de edificação existente para a instalação do complexo de imunização: crie, saúde do viajante e sala de vacina, em lote único",10101
"Contratação de empresas especializadas na prestação de serviços comuns de engenharia para o manejo arbóreo podas, supressões, destocas e secção de raízes incluindo mão de obra, serviços, ferramentas e equipamentos no município  de Belo Horiz...",20203
"Contratação de empresa para assessorar a fiscalização da Autoridade Portuária de Santos - APS no gerenciamento e acompanhamento da qualidade dos projetos e obras de reforma da avenida Perimetral da margem direita - Alamoa - Porto de Santos, pelo pra...",30101
"Contratação de empresa especializada para prestar serviços de furação e detonação com explosivos em rochas/saibro, de 2,5 a 3 polegadas de diâmetro, num total de 5.000 metros lineares na Saibreira atendendo as normas de execução e segurança do...",10302
"Contratação de pessoa jurídica para prestação de serviço de recuperação/proteção de 20 vinte nascentes, em atendimento ao convênio firmado entre o município de Itaipulândia e ITAIPU BINACIONAL, no âmbito do programa Itaipu Mais que Energia,...",10401
"Execução de reforma/manutenção das instalações do ESF Estratégia Saúde da Família - Primavera, localizada na Av. Adão Foques nº 331, Bairro Passo Fundo - na cidade de Guaíba/RS, conforme condições, quantidades e exigências estabelecidas ne...",10110
"Manutenção predial, reparos e instalações no alojamento para cursos e telhado da oficina Mecmoto do Segundo Batalhão de Polícia de Choque",10110
"Edital de Concorrência para restabelecimento da estrada Municipal ""Rota Caminhos do Pão e do Vinho"".",10201
"Contratação de empresas especializadas na prestação de serviços comuns de engenharia para o manejo arbóreo podas, supressões, destocas e secção de raízes incluindo mão de obra, serviços, ferramentas e equipamentos no município  de Belo Horiz...",20203
"Conservação e revitalização de vias públicas do Município com revestimento asfáltico, sinalização viária vertical, e horizontal. * https://licitar.digital *",10205
"Objetivando a execução de obras e serviços de Reforma da Câmara Municipal de Santa Isabel do Rio Negro, tendo por finalidade atender às necessidades do Poder Legislativo Municipal.",10101
"construção de uma Rotatória na zona urbana de Pimenta Bueno, conectando a Avenida Carlos Gomes e a Avenida Carlos Dornejes no município de Pimenta Bueno/RO * https://licitanet.com.br *",10205
Contratar empresa especializada em serviços de ARQUITETURA PARA EXECUÇÃO DO PROJETO DE AMBIENTAÇÃO DE INTERIOR da Unidade Operacional B055,10101
contração de empresa para a execução de serviços de manutenção predial sob demanda no município de Zé Doca * https://licitanet.com.br *,10110
"Contratação de Empresa Pessoa Jurídica Especializada em Construção Civil para executar a Construção de 03 Salas de Aula e Bloco com duas Salas e Banheiros na Escola Municipal Águia Dourada, situada na Linha 108, zona rural, em Pimenta Bueno/RO * ...",10101
"Contratação de Empresa Pessoa Jurídica Especializada em Construção Civil para executar a Construção de Biblioteca, Salas de Aula e Bloco de Banheiros na Escola Municipal de Ensino Infantil e Fundamental Nair Barros, situada na Rua Padre Feijó, n...",10101
"Contratação de empresa especializada para execução de obras de pavimentação em concreto betuminoso usinado a quente C.B.U.Q, sistema de drenagem e sinalização em parte da Rua Marília, no Bairro de Fátima e recapeamento asfáltico em C.B.U.Q da ...",10205
"Construção de pavimentação asfáltica, recapeamento, drenagens superficiais, profundas e sinalização no município de Coari, conforme condições e exigências estabelecidas constantes no Termo de Referência * https://licitanet.com.br *",10205
"Emergencial do Telhado, bloco escolar e cobertura caixa d'água , localizado na Rua Raposos, 97 - Lourdes, João Monlevade - MG, 35930-057, em conformidade com o Edital nº 07/2024 e seus anexos.",10101
"Credenciamento de pessoas jurídicas para prestação de serviços elétricos e hidráulicos, a serem executados conforme demanda",10110
"Seleção pública para contratação de empresa especializada para prestação de serviço de consultoria técnica em sustentabilidade para realização de Diagnóstico, Plano de premissas e Plano de logística sustentável de infraestrutura, contribuin...",30201
"Contratação de empresa especializada sob o regime de execução indireta, por empreitada global para execução de muro de contenção tipo cortina de concreto.",10206
"Contratação de empresa especializada em engenharia para Construção de Galpão Industrial em estrutura em Pré-Moldados, inclusive tapamentos laterais, com cobertura em telhas isotérmicas e edificação de instalações, com a finalidade de atender a...",10207
"Credenciamento para prestação de serviços de Engenharia e Topografia para o município, pelo prazo de 12 doze meses.",40101
CONTRATAÇÃO DE EMPRESA DE ENGENHARIA PARA A CONSTRUÇÃO DE PRAÇA DE EVENTOS NA ZONA URBANA DO MUNICÍPIO DE ANÍSIO DE ABREU - PI.,10205
"Contratação de serviços de obtenção de AVCB/ CLCB e equipamentos de segurança, do 51º BPMI e unidades subordinadas.",10110
"1653750 -Processo de Contratação - Coleta, Transporte e Análise de Água - AMEGB * www.publinexo.com.br/privado/ *",50101
"Convite para MANUTENÇÃO, CUSTEIO E CONSERVAÇÃO DA UNIDADE ESCOLAR - INDICAÇÃO SALDO NÃO IMPOSITIVO - TC - n.º 1024014/2024 - Manutenção predial.",10110
"CONTRATAÇÃO DE EMPRESA ESPECIALIZADA PARA A EXECUÇÃO DO PROJETO DE CONSTRUÇÃO DE RADIER, CONFORME AS ESPECIFICAÇÕES E CONDIÇÕES DETALHADAS NO PROJETO BÁSICO E SEUS ANEXOS, SEGUINDO AS NORMAS TÉCNICAS VIGENTES E AS EXIGÊNCIAS DESCRITAS DO EDI...",10305
"Pré-qualificação de pessoas Jurídicas, prestadoras de serviços de Engenharia e Manutenção no Município de Taboão da Serra.",10110
CONTRATAÇÃO DE EMPRESA PARA REFORMA DA COBERTURA E PINTURA GERAL DO CONJUNTO HABITACIONAL JARDIM MARIA CRISTINA E CONJUNTO HABITACIONAL RUA DA BICA - 19 BLOCOS - JD BELVAL.  ,10101
SERVIÇOS DE INFRAESTRUTURA E ARQUITETURA DE ETL,10205
"Contratação de empresa especializada para a prestação de serviços incluindo mão de obra e fornecimento de materiais, necessários para execução do projeto de manutenção da Escola Municipal de Ensino Fundamental Olavo Bilac, de Doutor Ricardo co...",10110
"Contratação de empresa especializada para a prestação de serviços incluindo mão de obra e fornecimento de materiais, necessários às obras de restabelecimento de galeria e tubulações na cidade de Doutor Ricardo/RS, de acordo com o Projeto Básic...",10205
Contratação de empresa para construção de prédio do CRAS Federal.,10101
"CONTRATAÇÃO DE EMPRESA ESPECIALIZADA NO FORNECIMENTO E INSTALAÇÃO DE EQUIPAMENTOS PARA ACADEMIA AO AR LIVRE NO MUNICÍPIO DE MONTE BELO - MG, VISANDO ATENDER ÀS DEMANDAS DA SECRETARIA MUNICIPAL DE OBRAS E SERVIÇOS PÚBLICOS.",10205
"Contratação de empresa especializada para construção da nova Delegacia Especializada de Defesa dos Direitos da Criança e do Adolescente - DEDDICA, no município de Cuiabá/MT",10101
"CONTRATAÇÃO DE EMPRESA ESPECIALIZADA PARA CONSTRUÇÃO DE REDE DE ILUMINAÇÃO ELÉTRICA NA RUA 06, SETOR SANTA ANGELA EM Alvorada-TO.",10208
CONTRATAÇÃO DE EMPRESA ESPECIALIZADA PARA CONSTRUÇÃO DE CALÇADAS NO SETOR CENTRAL NO MUNICÍPIO DE Alvorada-TO.,10205
"Contratação de empresa para execução de ampliação e reforma do ginásio, com área de 50,00m², localizada na comunidade do Assentamento 29 de Outubro no município de Trindade do Sul - RS.",10205
"* Registro de preços * * Licitação Eletrônica * REGISTRO DE PREÇOS PARA FUTURA E EVENTUAL EXECUÇÃO DE SERVIÇOS DE CONSERVAÇÃO, MANUTENÇÃO E ADAPTAÇÃO DE CALÇADAS, LOCALIZADAS EM DIVERSOS TRECHOS PÚBLICOS, MUNICÍPIO DE PIÚMA-ES",10205
"REFORMA E AMPLIAÇÃO DO CENTRO DE CONTROLE DE ZOONOSES, SITUADA NA RUA VICTOR CAMPISI, 250 - PQ. INDUSTRIAL DAS OLIVEIRAS.",10101
"CONTRATAÇÃO DE EMPRESA DE ENGENHARIA CIVIL PARA A EXECUÇÃO DE OBRAS E SERVIÇOS DE RECUPERAÇÃO DE ESTRADA VICINAL COM EXTENSÃO DE 46,19KM, NO MUNICÍPIO DE SÃO JOÃO DO PIAUÍ-PI.",10201
"REGISTRO DE PREÇOS PARA CONTRATAÇÃO DE EMPRESA ESPECIALIZADA EM RETALUDAMENTO DE ENCOSTA NATURAL COM CORTE, DRENAGEM BÁSICA E PROTEÇÃO SUPERFICIAL DA ÁREA DE RISCO NA RUA IRINEU BORNHAUSEN, EM BOM JARDIM DA SERRA - SC, ETAPA II",10205
Contratação de empresa para ampliação de Canil no município de São Joaquim. Emenda Parlamentar 202229250013   Código registro TCE: D1BC58E80F56418D7CF459A62CAD9CB4B610DCAF * https://licitar.digital *,10101
OBRAS DE CONSTRUÇÃO DE ALAMBRADO PARA CERCAMENTO DO LIXÃO MUNICIPAL. * https://bllcompras.com *,10307
REFORMA DO ESF 1 ELENIR MARIA ALVES. * https://bllcompras.com *,10101
"REFORMA E SUBSTITUIÇÃO DO FECHAMENTO DO TERRENO DA ESCOLA MUNICIPAL SANTA REGINA E CMEI ANTONIETA RECHIN LANDGRAF, AMBOS LOCALIZADOS NA RUA WANDERLEI JOÃO VIEIRA CLEVE, N°531, CONJUNTO SANTA REGINA, CONFORME ESPECIFICAÇÕES, QUANTITATIVOS E CONDIÇ...",10307
"Contratação de empresa para execução de obra comum de engenharia para execução de pavimentação com pedra irregular calçamento em trecho da estrada geral cordilheira Linha Espinilho área rural extensão de 1.100,00 m e 7.700,00m² de área a ser...",10201
Construção de Ecoponto no bairro Castelo Branco  - SMZC.  * https://bllcompras.com *,10101
Aquisição de Serviço de Poda e corte de Arvores e retirada dos resíduos produzidos na unidade Escolar.,20203
"CONCORRÊNCIA, na forma ELETRÔNICA, como critério de julgamento por MENOR PREÇO, com regime de execução de EMPREITADA POR PREÇO GLOBAL, cujo objeto é a Contratação de empresa de engenharia no ramo de construção civil, para reforma da Câmara M...",10101
"- Contratação de empresa de engenharia para elaboração de levantamento e dimensionamento das demandas de reforma, com memoriais, especificações, planejamento e planilha orçamentária para manutenção da sede do CRCES, bem como assessoria técnica...",30101
- Contratação de empresa especializada para execução de serviços de recuperação estrutural do Terminal Urbano Rodoviário Parque Cecap. - DEMAIS ESPECIFICAÇÕES CONFORME EDITAL. * www.compras.gov.br *,10101
"Obra de Construção do Centro de Referência de Assistência Social - CRAS, Contrato de Repasse nº 108940- 02 Convênio nº 946402/2023 - Programa Estruturação da Rede de Serviços do Sistema Único de Assistência Social SUAS - Políticas Públicas.",10101
Contratação de serviços a serem prestados na recuperação de diversas Unidades Básicas de Saúde - UBS em diversas localidades do Município de Porteiras/CE,10101
"Execução de Pavimentação Asfáltica, drenagem, rede de abastecimento de água, terraplanagem e sinalização viária na Estrada Av. Willy de Moraes, neste Município.",10201
"REGISTRO DE PREÇOS PARA CONTRATAÇÃO DE SERVIÇOS DE COLETA E ANÁLISES DE ÁGUA E EFLUENTES, DE FORMA PARCELADA, REALIZADAS POR LABORATÓRIO ACREDITADO PELO INMETRO, DE ACORDO COM A NECESSIDADE DO SAAEB, PELO PERÍODO DE 12 DOZE MESES * https://bllcom...",50101
Execução do passeio da Borges Esquina da Rua Marechal Floriano até a esquina da Rua Marechal Deodoro,10205
- Contratação de Instalação de Contraventamento nos Hangaretes 01 A 10 e Hangaretes de Giro do T-27 * www.compras.gov.br *,10201
"Contratação de empresa especializada em profissional em Agronomia, para Secretaria Municipal de Agricultura e Meio Ambiente. - ** www.comprasbr.com.br **",30201
"Contratação de Empresa Especializada de Consultoria para elaborar o Plano Municipal de Habitação de Interesse Social - PMHS de Herval d'Oeste/SC, no qual se constituirá em instrumento de planejamento do município para viabilizar o acesso à moradia...",30101
"CONTRATAÇÃO DE PESSOA JURIDICA PARA EXECUÇÃO DO PROJETO DE ""GERENCIAMENTO DE RESIDUOS SÓLIDOS PASSÍVEIS DE RECICLAGEM PARA IMPLEMENTAÇÃO DA POLÍTICA DE COLETA SELETIVA NO MUNICIPIO DE TAPAUÁ-AM"" TERMO DE CONVÊNIO N.º 06/2023. Processo n.º: 0...",20201
"- Contratação de empresa prestadora de serviços de engenharia, especializada em construção civil, para executar serviços de engenharia com fornecimento de mão de obra e materiais nos ambientes externos dos novos Núcleos de Atendimento da DPE/MA n...",10101
Prestação de serviços de adequação de estrada vicinal na zona rural do município de Isaias Coelho- PI,10201
"Constitui objeto da presente licitação a contratação de empresa para execução da obra de passeios da Rua Joaquim Barreto e Avenida Oscar Lucho, no Município de Quaraí, totalizando uma área de 1.150m2, a ser calçada. Emenda Especial nº202428670...",10205
"Convite para MANUTENÇÃO, CUSTEIO E CONSERVAÇÃO DA UNIDADE ESCOLAR - CX TC - n.º 1018684/2024.",10110
"Registro de preço para contratação de empresa especializada, com fornecimento de material e mão de obra para execução de sarjeta trapezoidal em concreto, sarjeta triangular em concreto e transposição de segmentos de sarjetas bem como meios-fios d...",10205
A PRESENTE LICITAÇÃO TEM COMO OBJETO O REGISTRO DE PREÇO PARA A CONTRATAÇÃO DE EMPRESA ESPECIALIZADA COM FORNECIMENTO DE MATERIAL E MÃO DE OBRA PARA APLICAÇÃO DE MANTA ASFÁLTICA PARA COBERTURAS DOS PRÉDIOS INSTITUCIONAIS DO MUNICÍPIO DE ANTÔN...,10110
"PRESTAÇÃO DE SERVIÇOS DE OBRAS EM GERAL PARA MANUTENÇÃO, REFORMA E CONSTRUÇÃO DE ESPAÇOS PUBLICOS. GINÁSIO DE ESPORTES, UNIDADE DE SAÚDE, ESCOLA NESTOR GUIMARÃES, EMATER E CAMPO MUNICIPAL",10205
"- Serviços de obtenção de AVCB/ CLCB e equipamentos de segurança, do 51º BPMI e unidades subordinadas * www.compras.gov.br *",10110
"CONTRATAÇÃO DE EMPRESA PARA MANUTENÇÃO CORRETIVA E PREVENTIVA PREDIAL DO PARQUE TECNOLÓGICO VANDA KARINA SIMIE BOLÇONE. SECRETARIA MUNICIPAL DE PLANEJAMENTO ESTRATÉGICO, CIÊNCIA, TECNOLOGIA E INOVAÇÃO. Site: https://compras.empro.com.br",10110
- Manutenção no alojamento destinado aos alunos do curso de formação de soldado e Manutenção no telhado da Mecmoto do 2º Batalhão de Polícia de Choque. * www.compras.gov.br *,10110
"CONTRATAÇÃO DE ESCRITÓRIO DE ENGENHARIA/ARQUITETURA , ESPECIALIZADA PARA PRESTAÇÃO DE SERVIÇOS TÉCNICOS PROFISSIONAIS SENDO A ELABORAÇÃO DE PROJETOS EXECUTIVOS COMPLETOS  DE ENGENHARIA/ARQUITETURA PARA PAVIMENTAÇÃO  COM ELEMENTO SEXTAVADO EM R...",30101
"Contratação de empresa especializada para a prestação de serviços em infraestrutura urbana, recapeamento, incluindo materiais, mão de obra e equipamentos, conforme memoriais descritivos, quantitativos e projeto",10205
"Contratação de empresas do ramo pertinente para REGISTRO DE PREÇOS visando a prestação de serviço de locação de máquina do tipo retroescavadeira de pneus traçada 4x4, locação com operador para execução de horas/maquinas para viabilizar a co...",10401
"CONTRATAÇÃO DE EMPRESA ESPECIALIZADA PARA EXECUÇÃO DE PAVIMENTAÇÃO ASFÁLTICA NA RUA LAURINDO CHIARELLO E RUA 7 DE SETEMBRO COM SINALIZAÇÃO VIÁRIA, BEM COMO CALÇADAS E SINALIZAÇÃO VIÁRIA NA RUA LAURINDO CHIARELLO, RUA 7 DE SETEMBRO E RUA XV ...",10205
"Contratação de empresa especializada para execução dos serviços de reforma e adequação de praça pública localizada no Bairro Coopha Fronteira, no Município de Ponta Porã-MS. - ** www.comprasbr.com.br **",10205
"CONTRATAÇÃO DE EMPRESA ESPECIALIZADA PARA EXECUÇÃO DE REFORMA/REVITALIZAÇÃO DA PRAÇA MUNICIPAL JOVANI CELUPPI LOCALIZADA NA AVENIDA JÚLIO CHIARELLO, CENTRO DE PLANALTO ALEGRE, DE ACORDO COM OS PROJETOS E MEMORIAL DESCRITIVO QUE ACOMPANHAM ESTE ED...",10205
"- Contratação de empresa especializada em serviços para adequação das instalações e gerenciamento do Programa Fábrica Verde, Secretaria Municipal de Meio Ambiente e Clima SMAC do Município do Rio Janeiro. * www.compras.gov.br *",30201
- Contratação de empresa especializada para execução de serviços de engenharia florestal atinentes a obra de Manutenção e Conservação da BR 110/316 do 7¨ Batalhão de Engenharia de Combate 7º BE Cmb * www.compras.gov.br *,10401
- Contratação de empresa especializada para execução de serviços de engenharia florestal atinentes a obra de Manutenção e Conservação da BR 110/316 do 7¨ Batalhão de Engenharia de Combate 7º BE Cmb * www.compras.gov.br *,10401
- Obras na Praça dos Salmos - Conjuntão Padre Miguel - localizado na Praça dos Salmos - Bangu * www.compras.gov.br *,10205
"- Registro de preços para eventual contratação de serviços de injeções em estruturas de concreto armado em sistemas produtores de água potável, sistemas de adução e Centros de Reservação, em atendimento à Diretoria Do Sistema De Abasteciment...",10209
"Contratação de empresa para reforma e ampliação do Posto de Saúde da comunidade de Mulungu, localizado na zona rural do Município de Felipe Guerra/RN, conforme especificações e demais elementos técnicos constantes no Projeto Básico.",10101
- Contratação da obra de ampliação do Pavilhão da Banda de Música do 25º BC. * www.compras.gov.br *,10101
"CONTRATAÇÃO DE EMPRESA ESPECIALIZADA EM CONSTRUÇÃO CIVIL PARA EXECUÇÃO DE SERVIÇOS DA REFORMA DE IMÓVEL SEDE DO INSTITUTO MUNICIPAL DE PREVIDÊNCIA DOS SERVIDORES PÚBLICOS MUNICIPAIS DE JOÃO PINHEIRO, MG COM FORNECIMENTO DE MÃO DE OBRA E MATER...",10101
CONTRATAÇÃO DE SERVIÇOS TÉCNICOS ESPECIALIZADOS EM ENGENHARIA PARA REALIZAR ESTUDO DE VIABILIDADE HÍDRICA PARA O ABASTECIMENTO PÚBLICO DA CIDADE DE MINEIROS - GO E OBTER A CONCESSÃO DE OUTORGA PREVENTIVA DE DIREITO DE USO DE RECURSOS HÍDRICOS PAR...,30201
"CONTRATAÇÃO DE EMPRESA ESPECIALIZADA PARA EXECUÇÃO DE SERVIÇOS DE REFORMA DO NÚCLEO AMPLIADO DE SAÚDE SONIA CINTAS, NO MUNICÍPIO DE PONTA PORÃ-MS - ** www.comprasbr.com.br **",10101
Contratação de empresa especializada para execução de serviços de engenharia referente à serviços remanescentes para conclusão da construção de uma Creche Proinfância - tipo 02. * https://bnccompras.com *,10101
Constitui objeto da presente CONCORRÊNCIA ELETRÔNICA A CONTRATAÇÃO DE EMPRESA DE ENGENHARIA PARA EXECUÇÃO DOS SERVIÇOS DE AMPLIAÇÃO DO CEMITÉRIO SÃO MIGUEL NO MUNICÍPIO DE BREJÃO-PE. * https://bnccompras.com *,10205
"Escolha da proposta mais vantajosa, objetivando a contratação de empresa especializada visando a execução de obra, com o devido fornecimento de materiais, equipamentos e mão-de-obra, necessários para realizar pavimentação asfáltica para a Rua J...",10205
CONTRATAÇAO DE SERVIÇOS DE PERFURAÇAO INSTALAÇAO E FUNCIONAMENTO DE POÇOS ARTESIANO NA LICALIDADE DE ARROIO GRANDE COMPREENDENDO TBEM BOMBAS DA AGUA E DEMAIS MATERIAS E SERVIÇOS PERTINENTES. * https://bnccompras.com *,10209
"contratação de empresa especializada no fornecimento de mão de obra qualificada e equipamentos para a execução de obra de drenagem de águas pluviais no Bairro Sibipiruna, na cidade de Chapadão do Sul/MS. * https://bllcompras.com *",10205
"CONTRATAÇÃO DE EMPRESA ESPECIALIZADA PARA FORNECIMENTO E EXECUÇÃO DE OBRAS DE COMBATE A INCÊNDIO NOS PRÉDIOS: ESCOLA MUNICIPAL PROFESSORA DULCÍDIA COSTA RIVABEN, ESCOLA MUNICIPAL DONA LEONTINA DE OLIVEIRA, CRECHE MUNICIPAL DENISE E. FAULBORN DENAR...",10110
"- Contratação de prestação de serviços contínuos de manutenção técnica, preventiva, corretiva, emergencial e conservação, incluindo o fornecimento e a substituição de partes e peças, dos elevadores instalados nos prédios das Unidades Escol...",10110
- Contratação de empresa especializada para reforma do fechamento perimetral muros de divisa do Fórum da Comarca de Rancharia. * www.compras.gov.br *,10307
CONTRATAÇÃO DE EMPRESA PARA OBTENÇÃO DE AUTO DE VISTORIA DO CORPO DE BOMBEIROS AVCB DE 15 UNIDADES VINCULADAS À SECRETARIA DE SAÚDE.,30101
"Prestação de serviços de construção de passagem molhada na Localidade Jenipapeiro, no município",10201
"CONTRATACAO DE SERVICOS DE DETECCAO DE VAZAMENTOS EM REDES, RAMAIS, CAVALETES E OUTROS COMPONENTES DO SISTEMA DE DISTRIBUICAO DE AGUA NA AREA DE ABRANGENCIA DA GERENCIA REGIONAL DE CURITIBA SUL   GRCTS, CONFORME DETALHADO NOS ANEXOS DO EDITAL.",10209
"Contratação de empresa Especializada em Instalação de Unidades Sanitárias Individuais USI's no Bairro Ribeirãozinho do Município de Barra do Chapéu, especificações e condições descritas no edital e seus anexos.",10209
"- Reforma do 3º andar da unidade do IDR Paraná localizada na Rua da Bandeira, nº 500 Curitiba Paraná * www.compras.gov.br *",10101
"- Contratação de prestação de serviços de perfuração e instalação de poço tubular profundo, conforme especificações técnicas do termo de referência. * www.compras.gov.br *",10209
O objeto da presente licitação é o Registro de Preços de empresa especializada na prestação de serviços de pedreiro e servente de pedreiro para construção e manutenção preventiva e corretiva dos sistemas públicos de abastecimento de água e d...,10209
- Serviço de elaboração de projeto e execução de acesso de ambulâncias * www.compras.gov.br *,10101
"Contratação de empresa do ramo para execução dos serviços de Construção de uma Passagem Molhada na Fazenda Olho D'agua, na área rural do Município de Parnamirim/PE",10201
"CONCORRÊNCIA PRESENCIAL, CONTRATAÇÃO DE EMPRESA PARA REFORMA E AMPLIAÇÃO NA UNIDADE BÁSICA DE SAÚDE, NO MUNICÍPIO DE BARBOSA - SP, CONFORME PLANILHA ORÇAMENTÁRIA E MEMORIAL DESCRITIVO.",10101
"Contratação de empresa especializada para a execução de reforma parcial da cobertura, incluindo a recomposição de forros e da rede elétrica, da Escola Estadual de Ensino Fundamental Marcelo Gama, localizada no Município de Restinga Seca.",10110
"Constitui-se objeto da presente licitação a contratação de empresa especializada em prestação de serviço para fornecimento de mão de obra, máquinas, equipamentos e todos os materiais necessários para execução do serviço de revestimento em ge...",10101
- Contratação de empresa para Conclusão da Reforma e Ampliação do Refeitório do IFAM/Campus Tabatinga. * www.compras.gov.br *,10101
"- Contratação de empresa especializada em engenharia para execução das obras de revitalização de área pública da Rua Pedra Cristal, 38 - Jardim das Pedras zona sul, São Paulo - Sp, 04856-720 / Rua dos Granitos, 5b - Jardim das Pedras zona sul, S...",10205
CONTRATAÇÃO DOS SERVIÇOS DE ENGENHARIA PARA CONSTRUÇÃO E REFORMA DE P´RAÇAS NO MUNICIPIO DO CRATO/CE.,10205
Pregão Eletrônico para contratação de empresa especializada em serviços de sondagem mista: sondagem a percussão complementada por sondagem rotativa para reconhecimento de subsolos para o município de Novo Hamburg,40101
"Contratação de empresa especializada para execução de obra de engenharia para instalação de central geradora de energia elétrica por meio de usina solar fotovoltaica conectada à rede da distribuidora deste município Energisa MS, na modalidade de...",10208
"Contratação de empresa especializada para a realização de serviços de manutenção corretiva das áreas prediais dos imóveis da Secretaria Municipal de Educação, descritos no termo de referência, com fornecimento de materiais e mão-de-obra, ent...",10110
