Objeto,Categoria
"Contratação de empresa especializada, por Sistema de Registro de Preços, para a realização de diagnóstico técnico a fim de qualificar e quantificar as proriedades agrícolas participantes do ""Programa de Recuperação de Recursos Hídricos e Pagam...",30201
"Contratação de empresa para revitalização da ciclovia na Estrada Daltro Filho, em atendimento ao Convênio nº 953352/2023 - Ministério das Cidades.",10205
VALOR REFERENTE CONTRATAÇÃO DE EMPRESA PARA FORNECIMENTO DE MATERIAL E MÃO DE OBRA PARA EXECUÇÃO DO PLANO DE PREVENÇÃO E PROTEÇÃO CONTRA INCÊNDIO(PPCI) UTILIZADOS NA OBRA DO CENTRO DE EVENTOS MUNICIPAL.,10110
"Contratação de empresa especializada na prestação de serviço de solo topografia e georreferenciamento, conforme sistema de informações geográficas (sig), que tem como finalidade o cadastramento e gerenciamento de dados geográficos de todo o terr...",40101
REFORMA CIVIL E ELÉTRICA DE SALAS DE AULA NA EEMTI BARÃO DE ARACATI.,10110
"Chamada Pública 15/08/2024 Divulgado Aguardando Abertura Nº do Edital: CC17/2024 Modalidade: Chamada Pública Data da Abertura: 15/08/2024 Valor Global: R$ 0,00 Objeto: O MUNICÍPIO DE LEBON RÉGIS, através do Agente de Contratação conforme decreto ...",10101
"CONTRATAÇÃO DE EMPRESA ESPECIALIZADA EM ENGENHARIA PARA EXECUÇÃO DA OBRA DE CONSTRUÇÃO DO CMEI LULAMAR RESENDE MORAIS, CONFORME DISPOSIÇÕES DO PROJETO BÁSICO EM ANEXO.",10101
"Pregão Eletrônico 28/08/2024 Divulgado Aguardando Abertura Nº do Edital: 28/PMCS/2024 Modalidade: Pregão Eletrônico Data da Abertura: 28/08/2024 Valor Global: R$ 123.571,05 Objeto: Registro de preços para contratação de empresas para prestação ...",10306
Contratação de empresa de engenharia para execução dos serviços de construção de auditório anexo à sede da Prefeitura na zona urbana do município de Belém do Piauí-PI.,10101
CONTRATAÇÃO DE EMPRESA ESPECIALIZADA NA EXECUÇÃO DE PAVIMENTAÇÃO DE VIAS EM PARALELEPÍPEDO NA ZONA URBANA DO MUNICIPIO DE RIO GRANDE DO PIAUÍ.,10205
"Pregão 02/09/2024 Divulgado Aguardando Abertura Nº do Edital: 30/2024 Modalidade: Pregão Data da Abertura: 02/09/2024 Valor Global: R$ 32.000,00 Objeto: CONTRATAÇÃO DE EMPRESA ESPECIALIZADA PARA A PRESTAÇÃO DE SERVIÇO DE PINTURA DE OBRA COMUM, IN...",10205
Contratacao de empresa na area de engenharia para execucao de obras de adequacao de barracao existente para a implantacao de um refeitorio para os funcionarios da Secretaria Municipal de Obras Viacao e Servicos Urbanos Almoxarifado Municipal.,10101
CONTRATACAO DE EMPRESA ESPECIALIZADA PARA ATENDER A DEMANDA DE EXECUCAO DE RECAPEAMENTO ASFALTICO EM CBUQ EM DIVERSAS RUAS DO PERIMETRO URBANO MUNICIPAL CONFORME CONDICOES QUANTIDADES E EXIGENCIAS ESTABELECIDAS NESTE INSTRUMENTO E NOS ANEXOS DO EDITA PAR...,10205
Contratação de empresa especializada para a execução da obra pública de pavimentação em piso intertravado e drenagem em dois trechos de estrada vicinal do Bairro Guabiroba conforme Convênio de Saída nº 1491001046/2023/SEGOV/PADEM.,10201
"Contratação de serviço de instalação de tubulação de gás em Pex Multicamadas e trecho em cobre para atender o setor de Aprovisionamento da 2ª Cia Com Mec, com fornecimento de material e mão de obra pela empresa.",10110
CONTRATACÃO DE SERVIÇOS TÉCNICOS ESPECIALIZADOS DE ENGENHARIA (PROJETOS E EXECUCÃO) PARA ATENDIMENTO AO PLANEJAMENTO DOS RECURSOS E METAS DO PROGRAMA DO PRÓ CONSÓRCIO RES SES MG 9043,10101
"Contratação de empresa do ramo para a execução dos serviços de construção de rede de distribuição de energia elétrica aérea (RDU) na Rua Carlos Grahl, com fornecimento de material e mão de obra, no padrão CELESC DISTRIBUIÇÃO S/A de rede pr...",10208
"- CONTRATAÇÃO DE EMPRESA PARA PRESTAÇÃO DE SERVIÇOS DE ENGENHARIA RELATIVOS À REFORMA E CONSTRUÇÃO DO MURO DO COLÉGIO MUNICIPAL NOSSA SENHORA APARECIDA, SITUADA NA LOCALIDADE DE VILA APARECIDA, ZONA RURAL DE REMANSO/BA, CONFORME CONVÊNIO Nº 07...",10307
"Registro de preços para eventual e futura prestação de serviços de recomposição de pavimentação asfáltica (tapa buraco) e execução de lombadas com em CBUQ (concreto betuminoso usinado a quente) faixa “C” padrão DER, com o fornecimento de ...",10205
CONTRATACAO DE EMPRESA PARA ELABORACAO E EXECUCAO DO PROJETO E FORNECIMENTO DE MATERIAIS E MAO DE OBRA ESPECIALIZADA PARA ATENDER A ILUMINACAO PUBLICA DA RUA PEDRO ALVES DE OLIVEIRA,10208
"O objeto do presente procedimento é a escolha da proposta mais vantajosa para a contratação, por dispensa de licitação, de serviço de instalação do sistema elétrico de acionamento de uma bomba de incêndio de 15CV em rede trifásica 220V.",10110
"Contratacao de empresa especializada visando execucao de obras de pavimentacao asfaltica de vias publicas em CBUQ sobre paralelepipedo nas ruas Agenor Brandao, Praca Joao Santos, Rua Augusto Asterio, Rua Gerson Sales e Rua Eliezer Sena, no municipio de C...",10205
"Construção de infraestrutura urbana (lazer), contendo campo de futebol com grama sintética no Bairro Santa Terezinha.",10205
CONTRATAÇÃO DE PESSOA JURÍDICA ESPECIALIZADA EM ENGENHARIA PARA A EXECUÇÃO DO PROJETO BÁSICO DE ENGENHARIA PARA PAVIMENTAÇÃO EM CBUQ SOBRE PAVIMENTAÇÃO EXISTENTE DA RUA SÃO JOÃO DE FLORIANO-PI,30101
"Contratação de Empresa Especializada para a Reforma da Escola EMEIEF Prof.ª Nelci Gomes da Costa, situada na Rod. ES-379, Barra de Santa Rosa, Irupi/ES, com o fornecimento de todo o material e mão de obra necessária.",10101
Contratação de empresa especializada para a execução da obra pública de pavimentação em piso intertravado e drenagem em dois trechos de estrada vicinal do Bairro Guabiroba conforme Convênio de Saída nº 1491001046/2023/SEGOV/PADEM.,10201
"Contratação de empresa especializada em serviços de pavimentação asfáltica nas ruas, Gercino Pereira da Costa; Geraldo Marques Rodrigues; José Vila Nova; Geralda Augusta Reis; Prudenciana Barbosa Duarte; a; b; Geraldo Antônio da Silva; Rosangela ...",10205
"Contratação de Empresa para prestação de serviço de fornecimento e implantação do sistema de irrigação agrícola, por aspersão e gotejamento",10211
"CONTRATAÇÃO DE EMPRESA ESPECIALIZADA PARA ILUMINAÇÃO DO CAMPO DE FUTEBOL, LOCALIZADO NA COMUNIDADE DE MUCAMBO, SITUADO NO MUNICIPIO DE BALDIM-MG, CONFORME PROJETO / PLANILHA ORÇAMENTÁRIA/MEMORIAL DESCRITIVO/ CRONOGRAMA FISICO FINANCEIRO / MEMÓRIA ...",10208
"CONTRATAÇÃO DE EMPRESA PARA EXECUÇÃO DE DESVIO E REPOSICIONAMENTO DE REDE FLUVIAL EXISTENTE NA AVENIDA ARMANDO FAJARDO, COM FORNECIMENTO DE EQUIPAMENTOS, MÃO-DE-OBRA, MATERIAIS E SERVIÇOS TÉCNICOS NECESSÁRIOS À EXECUÇÃO DO OBJETO.",10205
"Contratação de empresa de engenharia e/ou arquitetura para execução das obras de reforma do pátio com acréscimo de telhado interno da Escola Municipal Eugênia Vieira, localizada na rua Padre Antônio Diogo Freijó, nº 380, bairro Pousada Del Rei ...",10101
CONSTITUI OBJETO DESTA LICITAÇÃO A CONTRATAÇÃO DE EMPRESA ESPECIALIZADA NA EXECUÇÃO DE OBRA DE CONSTRUÇÃO DE GABIÃO NO DISTRITO DE SETE CACHOEIRAS,10206
"Contratação de empresa especializada em Prestação de Serviços para troca do conjunto motobomba e quadro de comando completo, com fornecimento de mão de obra e materiais, no poço artesiano do bairro Vargem Alegre, em atendimento a solicitação da ...",10209
"Contratação de empresa especializada em obras para execução dos serviços de recapeamento asfáltico da Rua Isaias Victor Sobrinho, no Município de Paripiranga/BA.",10205
"Contratação de empresa especializada para realização de levantamentos, estudos, diagnósticos, prognósticos, proposições, cenários, soluções públicas que componham embasamento técnico para elaboração do Plano Diretor de Cerqueira César",30101
CONTRATAÇÃO DE EMPRESA PARA EXECUÇÃO DE OBRA DA CONSTRUÇÃO DAS SALAS MODULARES E REFEITÓRIO NA E.B.M. PEQUENO PRÍNCIPE.,10101
"Contratação de empresa especializada visando execução de obras de pavimentação asfáltica de vias públicas em CBUQ sobre paralelepípedo nas ruas Agenor Brandão, Praça João Santos, Rua Augusto Astério, Rua Gerson Sales e Rua Eliezer Sena, no m...",10205
CONTRATAÇÃO DE EMPRESA ESPECIALIZADA NA EXECUÇÃO DE PAVIMENTAÇÃO DE VIAS EM PARALELEPÍPEDO NA ZONA URBANA DO MUNICIPIO DE RIO GRANDE DO PIAUÍ,10205
"CONTRATAÇÃO DE EMPRESA ESPECIALIZADA EM SERVIÇOS DE CONSTRUÇÃO CIVIL PARA EXECUÇÃO DE PAVIMENTAÇÃO ASFALTICA PARA RUA GABRIEL BASTIDES E RECAPEAMENTO ASFALTICO PARA RUA JOAQUIM BARBOSA, LOCALIZADOS NO BAIRRO VILA GUARANI , MUNICIPIO DE PEDRO DE ...",10205
ELABORAÇÃO DE PROJETOS DE ARQUITETURA/ENGENHARIA PARA ATENDER AS DEMANDAS DO FUNDO DE PREVIDÊNCIA DO MUNICÍPIO DE ÁGUAS LINDAS DE GOIÁS,30101
"Execução de obra, sob o regime de empreitada integral, pelo menor preço global, de varandas cobertas pré-moldadas na Escola Municipal de Ensino Fundamental 18 de Abril, em Fortaleza dos Valos/RS.",10101
"CONCORRENCIA Nº 022/2024CONTRATAÇÃO DE EMPRESA ESPECIALIZADA NA EXECUÇÃO DE OBRA DE PAVIMENTAÇÃO E RECUPERAÇÃO DO PAVIMENTO ASFALTICO EM DIVERSAS RUAS DOS BAIRROS PARQUE SANTA RITA DE CASSIA E PARQUE MARAJÓ, CONFORME CONTRATO DE REPASSE N. 9452...",10205
"Contratação de empresa especializada para execução das obras de construção e recuperação de passagens molhadas em diversas localidades no Município de Quixelô/CE, nos moldes do Plano de Trabalho/MAPP nº 2944 - Convênio nº 158/2024, celebrado...",10201
"Contratação de empresa especializada para a Execução dos Serviços de Pavimentação em Paralelepípedo no município de Parnaíba – PI, nos seguintes trechos: Rua Da Creche; Rua da Subestação tabuleiros II; Rua Estrada de Piçarra; Rua Travessa ...",10205
"Prestação de serviços de EXECUÇÃO DOS SERVIÇOS DE PAVIMENTAÇÃO EM PARALELEPÍPEDO, COM ÁREA DE 1.387,50M², NAS RUAS SANTA LUZIA – TRECHO 1 E 3 NO BAIRRO VILA SANTA BARBARA E RUA ADOLFO CHAVES NO BAIRRO SANTA CLARA NO MUNICÍPIO DE TERESINA-PI...",10205
"CONTRATAÇÃO DE EMPRESA ESPECIALIZADA PARA ELABORAÇÃO DO ESTUDO TÉCNICO SOCIOAMBIENTAL (ETSA) DE ÁREA DE PRESERVAÇÃO PERMANENTE EM NÚCLEOS URBANOS CONSOLIDADOS (ÁREA URBANA CONSOLIDADA DA SEDE E NOS DISTRITOS DE MARCÍLIO DIAS, FELIPE SCHMIDT, P...",30201
"- CONTRATAÇÃO DE EMPRESA DE ENGENHARIA PARA PAVIMENTAÇÃO DE VIAS PÚBLICAS NO MUNICÍPIO DE FRANCINÓPOLIS – PI, RELATIVO AO CONVÊNIO Nº 940062/2022 – MINISTÉRIO DAS CIDADES.",10205
CONTRATACAO DE EMPRESA ESPECIALIZADA PARA EMPREITADA GLOBAL MAO DE OBRA E MATERIAL PARA PAVIMENTACAO EM CBUQ E DRENAGEM DA ESTRADA DA LINHA 5 PINHEIRO MACHADO TRECHO 04 NO SENTIDO OESTE NUMA EXTENSAO DE 230 METROS COM AREA DE 1.656 00 M COM RECURSO DE EM...,10201
- CONTRATAÇÃO DE EMPRESA DE ENGENHARIA PARA EXECUÇÃO DOS SERVIÇOS DE PAVIMENTAÇÃO ASFÁLTICA EM TSD NO MUNICÍPIO DE FRANCINÓPOLIS – PI.,10205
"Concorrência Pública 17/09/2024 Divulgado Aguardando Abertura Nº do Edital: 003/2024 - FMEDUCA Modalidade: Concorrência Pública Data da Abertura: 17/09/2024 Valor Global: R$ 0,00 Objeto: CONTRATAÇÃO DE EMPRESA PARA EXECUÇÃO DE OBRA DA CONSTRUÇ...",10101
"CONTRATAÇÃO DE EMPRESA ESPECIALIZADA EM OBRAS DE ENGENHARIA PARA EXECUÇÃO DE REFORMA DE CEMITÉRIO DE IAPU/MG, EM ATENDIMENTO A SECRETARIA DE OBRAS, NOS TERMOS DO PLANO DE AÇÃO N° 09032023033378, MODALIDADE DE TRANSFERENCIA FEDERAL.",10205
"CONTRATAÇÃO DE EMPRESA ESPECIALIZADA PARA PRESTAÇÃO DE SERVIÇOS DE PAVIMENTAÇÃO EM BLOCOS PRÉ-MOLDADOS NAS ESTRADAS DA COMUNIDADE RURAL DOS RAMOS, ZONA RURAL, MUNICÍPIO DE IAPU/MG, CONFORME O CONVÊNIO Nº 1301000853/2024, FIRMADO ENTRE SEINFRA ...",10201
CONTRATACAO DE EMPRESA ESPECIALIZADA PARA SOLUCAO DE PROBLEMAS DE INFRAESTRUTURA NA BAS 133 EXECUCAO DE GUIAS SARJETAS PAVIMENTACAO ASFALTICA E LOMBADAS.,10205
Recapeamento Asfaltico nas vias Rua Benedito Antonio de Campos e Rua Angelo Ribeiro no municipio de Boituva SP,10205
"CONTRATACAO DE EMPRESA ESPECIALIZADA PARA PRESTACAO DE SERVICO DE MAO DE OBRA GLOBAL PARA CONSTRUCAO DE UMA NOVA PRACA PUBLICA NO DISTRITO DE DOURADINHO, CONFORME PROJETO BASICO,",10205
"- Execução global para capa asfáltica do tipo CBUQ na Rua Jacob Vontobel, trecho entre a Rua Alberto Schmidt até a Rua João Wichrowiski, com extensão de 381,51 metros, localizada no Bairro Jardim e área linear de 3.175,66 m², conforme memorial de...",10205
CONTRATAÇÃO DE EMPRESA ESPECIALIZADA PARA A PRESTAÇÃO DE SERVIÇOS DE ELABORAÇÃO DE 01 (UM) PROJETO DE ENGENHARIA PARA PERFURAÇÃO DE POÇO TUBULAR PROFUNDO EM LOCALIDADE ESPECÍFICA DO MUNICÍPIO DE CORONEL XAVIER CHAVES/MG,30201
"Serviços comuns e serviços comuns de engenharia 07 - 19 OBRAS CIVIS DE PAVIMENTACAO E SISTEMA VIARIO,",10205
"Serviços comuns e serviços comuns de engenharia 07 - 04 OBRAS CIVIS DE DRENAGEM,",10205
"Contratação de empresa de Engenharia para Execução da pavimentação em paralelepípedo na zona urbana do município de Barras - PI, conforme anexo I.",10205
"Contratação de empresa especializada em obras de engenharia para execução de reforma de cemitério de IAPU/MG, em atendimento a secretaria de Obras, nos termos do Plano de Ação n° 09032023033378, Modalidade de Transferência Federal.",10205
"Contratação de empresa especializada para execução de pavimentação em Concreto Asfáltico Usinado a Quente (CAUQ), com fornecimento de material, no Trecho 07 da Estrada da Linha Tapera, Gramado/RS.",10201
"Contratação de empresa especializada para a execução dos serviços de obra de engenharia na construção de praças públicas no povoado de Rio Abaixo, e, no Distrito de Itanagé, neste munícipio.",10205
"Contratação de empresa para pavimentação em vias, com calçada, meio-fio e sarjeta no município de Juruá, no estado do Amazonas.",10205
"Contratação de empresa para construção de quadras de areia nos bairros Aparecida e Valões, nas localidades de Colônia Escada, Rio Branco e São Pascoal, incluindo materiais e mão de obra, conforme projetos, memorial descritivo, cronograma financei...",10205
"Contratação de empresa de engenharia para execução de obras/serviços de Implantação de UBS PORTE 1 (NOVO PAC) na URBIS I, no Município de Amargosa/BA.",10101
"Contratação de empresa especializada na prestação de serviço de reparos de pinturas e acabamentos com fornecimento de materiais, para atender as necessidades do Prédio “Anexo A” ao Palácio Iguaçu e sob a responsabilidade da Casa Militar, conf...",10110
"Contratação de empresa especializada para execução de iluminação do campo de futebol do Assentamento Companheira Roseli Nunes, conforme projeto, planilha orçamentária e demais anexos.",10208
Contratação de Empresa Especializada para Execução da Infraestrutura Urbana do Bairro Mosqueiro - Zona de Expansão - Aracaju/SE.,10205
"Pavimentação em asfalto C.B.U.Q de vias públicas de perímetro urbano, no Município de Licínio de Almeida.",10205
Contratação de empresa para execução de recapeamento asfáltico PMQ e CBUQ nas ruas Santo Ângelo e Senador Salgado Filho.,10205
"Execução de obra de engenharia para reforma e modernização da Praça Jaime Trindade, no município de Pavão, em Minas Gerais.",10205
Contratação de empresa de engenharia especializada na realização das obras de término da Farmácia de Minas localizada na sede de Itaverava-MG.,10101
Contratação de empresa especializada para a execução dos serviços de pavimentação asfáltica com CBUQ na sede do Município de Ubajara/CE.,10205
"Pavimentação asfáltica, com fornecimento de material e mão-de-obra, em diversos trechos na cidade de Cândido Godói - RS.",10205
"CONTRATAÇÃO DE EMPRESA PARA EXECUÇÃO DE OBRAS E SERVIÇO DE ENGENHARIA, MENOR PREÇO POR EMPREITADA GLOBAL, EXECUÇÃO DO CALÇAMENTO EM PAVIMENTO INTERTRAVADO EM BLOCO SEXTAVADO E DRENAGEM PLUVIAL NO TRECHO DA SERRA DO BELO MONTE, ZONA RURAL DO MUNI...",10205
"- Contratação de empresa especializada para prestação de serviços de instalação de infraestrutura de rede lógica e de rede elétrica, sob demanda, com o fornecimento dos materiais e da mão de obra necessários, conforme condições e especifica...",10110
"CONTRATAÇÃO DE EMPRESA DE ENGENHARIA PARA PAVIMENTAÇÃO DE VIAS PÚBLICAS NO MUNICÍPIO DE FRANCINÓPOLIS – PI, RELATIVO AO CONVÊNIO Nº 940062/2022 – MINISTÉRIO DAS CIDADES.",10205
Contratação de empresa para prestação de serviços de pintura de sinalização viária horizontal (com fornecimento do material) de ruas do Município de São Domingos das Dores,10306
"CONTRAÇÃO DE EMPRESA PARA PRESTAÇÃO DE SERVIÇOS CONTÍNUOS DE, ESGOTAMENTO, LIMPEZA E DESEMTUPIMENTO DE FOSSAS SÉPTICAS, DA MUNICIPALIDADE DA CIDADE DE CAMPO ALEGRE DE GOIÁS, EM ATENDIMENTO AS SECRETARIAS E FUNDOS MUNICIPAIS DESTE MUNICIPIO",20102
"EXECUÇÃO DE SERVIÇOS DE CONSTRUÇÃO DE CRECHE, COM FORNECIMENTO DE MATERIAIS E MÃO DE OBRA.",10101
CONTRATACAO DE EMPRESA PARA EXECUCAO DE OBRAS DE TERRAPLANAGEM PAVIMENTACAO ASFALTICA COM CBUQ MICRO DRENAGEM SINALIZACAO NA ESTRADA MORRO DAS BATATAS TRECHO I FASE II,10201
- Contratação de empresa especializada para execução de pavimentação em paralelepipedo e meio fio granitico,10205
"CONTRATAÇÃO DE EMPRESA ESPECIALIZADA EM LIMPEZA DE FOSSA, PARA EXECUTAR SERVIÇOS PARA 02(DUAS) UNIDADES ESCOLARES",20102
"Contratação de empresa especializada em Prestação de Serviços de Engenharia, por empreitada por preço global, para a Pavimentação de Trechos Rurais e Urbanos dos Bairros Beleza, Grotão, Lambari II, Cruz e Jardim Imperatriz, com recursos do conv...",10205
"Placas de Sinalização: PARE (Cód.R-1), PROIBIDO VIRAR À DIREITA/ESQUERDA (Cód.R-4a/R-4b), Placa PROIBIDO ESTACIONAR (Cód.R-6), VELOCIDADE MAX.PERMITIDA (Cód.R-19), PERMITIDO ESTAC.15MIN-FARMACIA, CARGA E DESCARGA, FAIXA DE PEDESTRE (Cód.A-32b), P...",10306
"CONTRATAÇÃO DE EMPRESA PARA EXECUTAR A PAVIMENTAÇÃO ASFÁLTICA DA RUA SEVERINO FÁVERO, LOCALIZADA NO BAIRRO DOIS PINHEIROS, EM VIDEIRA-SC, COM ÁREA DE INTERVENÇÃO DE 2.782,74M² E EXTENSÃO DE 544,00M, CONFORME PROJETO BÁSICO.",10205
"- REGISTRO DE PREÇOS, para futura e eventual contratação de empresa para prestação de serviços de desentupimento e limpeza de fossa séptica para o Município de Erval Velho/SC, nos termos e condições descritos e especificados no Anexo II – Ter...",20102
"CONTRATAÇÃO DE EMPRESA ESPECIALIZADA PARA RECONSTRUÇÃO DO MURO E COBERTURA METÁLICA NO DEPOSITO DO SAAE, LOCALIZADO NA RUA CURVELO, N° 10, BAIRRO DO CAMPO, MUNICÍPIO DE CONSELHEIRO PENA/MG",10101
"- Contratação de empresa para execução de drenagem, pavimentação asfáltica e sinalização viária, localizada na Rua Arcanjo Cândido da Silva, Bairro Praia de Fora, Palhoça/SC, incluindo fornecimento de material e mão de obra.",10205
"Contratação de empresa especializada para realização de serviços geotécnicos de sondagem de solo a percussão - SPT, visando a construção da Cadeia Pública de Caxias do Sul, em terreno localizado a na RS453, Km-176,5, Rincão das Flores, Caxias ...",40101
"Contratação de empresa especializada para a prestação de serviços de engenharia, relativos à CONSTRUÇÃO DO MERCADO MUNICIPAL DE LAGOA GRANDE/PE.",10101
"Contratação de empresa especializada para a execução de obra de Recapeamento em CBUQ em ruas e avenidas do perímetro urbano do município de Junqueirópolis, com fornecimento de mão-de-obra, materiais de primeira linha e equipamentos necessários.",10205
- Contratação de empresa para execução de obras de infraestrutura (pavimentação asfáltica e drenagem) no prolongamento da Av. Osvaldo Honório pereira até a Av. Ney Fernandes Bolonha e prolongamento da Av. Ney Fernandes Bolonha até a Rua Virgíl...,10205
"CONTRATAÇÃO DE EMPRESA ESPECIALIZADA PARA A EXECUÇÃO DE REFORMA DA COZINHA DO CENTRO ADMINISTRATIVO COM AÉREA DE 7,68 M², PARA SUPRIR AS NECESSIDADES DA SECRETARIA DE ADMINISTRAÇÃO E PLANEJAMENTO, CONFORME MEMORIAL DESCRITIVO ESPECIFICAÇÕES CON...",10101
"Registro de Preços para a contratação de horas de serviço de empresa especializada em Serviço de levantamento Topográfico, com fornecimento de Anotação de responsabilidade Técnica, desenhos elaborados em plataforma CAD para cada levantamento, fo...",40101
"Contratação de empresa especializada para a prestação de serviços de engenharia, relativos à Pavimentação em Paralelepípedo Granítico na Rua Bela Vista, no Bairro Alto Grande, no Município de Lagoa Grande/PE, conforme Emendas Especiais Minist...",10205
CONTRATAÇÃO DE EMPRESA ESPECIALIZADA PARA REQUALIFICAÇÃO DE 05 ESCOLAS NA SEDE E ZONA RURAL DO MUNICÍPIO DE EUCLIDES DA CUNHA - BAHIA,10101
CONTRATACAO DE EMPRESA ESPECIALIZADA EM CONSTRUCAO CIVIL PARA EXECUTAR OBRA DE CALCAMENTO EM BLOQUETE SEXTAVADO NA AVENIDA GETULIO VARGAS NOS BAIRROS ALFREDO DIAS E VILA VERIDIANA E RUA GILVAN DOS SANTOS MOURA NO BAIRRO OSMANI BARBOSA,10205
"Contratação de empresa para prestação de serviço com fornecimento de materiais com a finalidade de realizar serviços comuns de engenharia na forma do Decreto Municipal 102/2022 para a reforma do imóvel situado a Rua Manoel Caeiro, 56, Centro, em Q...",10101
"CONTRATAÇÃO DE OBRAS E SERVIÇOS DE ENGENHARIA PARA CONSTRUÇÃO DA ESTAÇÃO ELEVATÓRIA ÁGUA TRATADA EAET PARA ATENDER A COMUNIDADE DE LAGOA DAS CARNAÚBAS, NO MUNICÍPIO DE MORADA NOVA–CE, SOB RESPONSABILIDADE DO SERVIÇO AUTÔNOMO DE ÁGUA E ESG...",10209
"CONCORRÊNCIA PRESENCIAL Nº 001/2024 OBJETO: CONTRATAÇÃO DE EMPRESA COM FORNECIMENTO DE MATERIAL E MÃO DE OBRA PARA CONSTRUÇÃO DE PONTE DE CONCRETO ARMADO SOBRE O CÓRREGO JAGORA, ESTRADA MUNICIPAL SJP-030, CONFORME PROJETO, PLANILHA E MEMORIAL DE...",10204
"Contratação de empresa de obras especializada em serviços de engenharia/geologia para perfuração de um poço artesiano tubular profundo (280 metros), contemplando o fornecimento de materiais e mão de obra.",10209
"Contratação de empresa especializada em engenharia civil, para execução de obra Rua Francisco Miguel – Melhoria viário, conforme especificações do Estudo Técnico Preliminar e termo de referência, memorial descritivo, cronograma físico-finance...",10205
"CONTRATAÇÃO DE EMPRESA ESPECIALIZADA EM ENGENHARIA, PARA EXECUÇÃO DE SERVIÇOS DE CONSTRUÇÃO DE PONTE COM ADUELAS, NO ASSENTAMENTO MATA GRANDE NO MUNICÍPIO DE SÃO DOMINGOS. | COMPRAS AGRUPADAS DOS PED",10204
- EVENTUAL CONTRATAÇÃO DE EMPRESA PARA O FORNECIMENTO DE MATERIAIS E PRESTAÇÃO DE SERVIÇOS NA SUBSTITUIÇÃO DA ILUMINAÇÃO PÚBLICA EXISTENTE POR ILUMINAÇÃO COM LUMINÁRIAS DE LED NA SEDE E POVOADOS DO MUNICÍPIO DE WENCESLAU GUIMARÃES,10208
"- Registro de preços para eventual e futura prestação de serviços de recomposição de pavimentação asfáltica (tapa buraco) e execução de lombadas com em CBUQ (concreto betuminoso usinado a quente) faixa “C” padrão DER, com o fornecimento d...",10205
"- CONTRATAÇÃO DE EMPRESA PARA EXECUÇÃO DE TERRAPLENAGEM, MICRODRENAGEM, PAVIMENTAÇÃO E SINALIZAÇÃO VIÁRIA DA RUA BENTO ROSA, BAIRRO CARNEIROS, COM FORNECIMENTO DE MATERIAL E MÃO DE OBRA COM RECURSOS FINANCEIROS PROVENIENTES DE AÇÕES DE RESPOS...",10205
"- Contratação de empresa especializada com fornecimento de material e mão de obra para execução de pavimentação asfáltica na Rua Júlio Anzanello e na Av. Tiradentes, no Bairro Esperança e para execução de base e sub-base na Rua Dr. João Caru...",10205
- Contratação de Empresa Especializada em Serviços de Engenharia para Calçamento em paralelepípedo ligando os Povoados São Domingos a Lagoa dos Porcos em Feira Nova/Se,10205
"- Contratação de Empresa Especializada em Construção Civil para executar a Reforma e Ampliação do Centro de Capacitação Educacional Maria Conceição de Souza, conforme projeto básico, planilhas e cronogramas, com recursos provenientes do Termo ...",10101
- CONTRATAÇÃO DE EMPRESA ESPECIALIZADA EM LIMPEZA DE FOSSA E TRATAMENTO DE EFLUENTES - SMECELT,20102
- CONTRATAÇÃO DE PESSOA JURÍDICA ESPECIALIZADA EM ENGENHARIA PARA A EXECUÇÃO DO PROJETO BÁSICO DE ENGENHARIA PARA PAVIMENTAÇÃO EM CBUQ SOBRE PAVIMENTAÇÃO EXISTENTE DA RUA SÃO JOÃO DE FLORIANO-PI,30101
"- Contratação de empresa especializada visando execução de obras de pavimentação asfáltica de vias públicas em CBUQ sobre paralelepípedo nas ruas Agenor Brandão, Praça João Santos, Rua Augusto Astério, Rua Gerson Sales e Rua Eliezer Sena, no...",10205
CONTRATAÇÃO DE EMPRESA PARA A PRESTAÇÃO DE SERVIÇOS NA ELABORAÇÃO DE PROJETO DE INSTALAÇÃO ELÉTRICA PARA AUMENTO DE CARGA EM 09 (NOVE) ESCOLAS DESTE MUNICÍPIO DE AQUIDABÃ – SERGIPE,30101
- CONTRATAÇÃO DE EMPRESA ESPECIALIZADA NA EXECUÇÃO DE PAVIMENTAÇÃO DE VIAS EM PARALELEPÍPEDO NA ZONA URBANA DO MUNICIPIO DE RIO GRANDE DO PIAUÍ,10205
"- CONTRATAÇÃO DE EMPRESA ESPECIALIZADA PARA A REALIZAÇÃO DE ANÁLISES EM AMOSTRAS DE ÁGUA E ANÁLISES EM AMOSTRAS DE EFLUENTES, BEM COMO A RETIRADA DAS AMOSTRAS NO MUNICÍPIO DE CARMÉSIA, EM ACORDO COM AS ESPECIFICAÇÕES E DETALHAMENTOS DESCRITOS ...",50101
"- Contratação de empresa de engenharia para execução dos serviços de Pavimentação Asfáltica em TSD em ruas da sede de Ibitiara – BA (Contrato de Repasse (CR) de n° 952730/2023 – Operação nº 1091307-71/2023), conforme condições e exigên...",10205
CONTRATAÇÃO DE EMPRESA DE ENGENHARIA E/OU ARQUITETURA PARA REFORMA – PINTURA GERAL (INTERNA E EXTERNA) DA DELEGACIA REGIONAL DE POLÍCIA – DRP DE CAÇADOR - SC.,10101
"- Contratação de Empresa especializada em engenharia para restauração viária da Avenida Maranhão e Avenida Alcides Fontes, em Aracaju/SE.",10205
